{
  "schemaVersion": "1.0",
  "deckId": "why-ppagent",
  "skinId": "northeastern-university-001",
  "pages": [
    {
      "pageId": "p1",
      "intentId": "p1",
      "compositionId": "editorial-list",
      "componentItemIds": [],
      "componentContentMode": "none",
      "textSlots": [
        {
          "slotId": "lead",
          "sourceItemIds": [
            "judgment"
          ],
          "contentMode": "title"
        },
        {
          "slotId": "body",
          "sourceItemIds": [
            "judgment",
            "rework"
          ],
          "contentMode": "full"
        }
      ],
      "reason": "judgment title becomes the lead thesis; its body and rework's title+body fill the body slot as a list."
    },
    {
      "pageId": "p2",
      "intentId": "p2",
      "compositionId": "editorial-focus",
      "componentItemIds": [],
      "componentContentMode": "none",
      "textSlots": [
        {
          "slotId": "primary",
          "sourceItemIds": [
            "fixed-is-good"
          ],
          "contentMode": "full"
        },
        {
          "slotId": "support",
          "sourceItemIds": [
            "not-reinvent"
          ],
          "contentMode": "full"
        }
      ],
      "reason": "Primary emphasizes 'fixed is good' as the key point; support provides the contrasting premise."
    },
    {
      "pageId": "p3",
      "intentId": "p3",
      "compositionId": "editorial-list",
      "componentItemIds": [],
      "componentContentMode": "none",
      "textSlots": [
        {
          "slotId": "lead",
          "sourceItemIds": [
            "understand"
          ],
          "contentMode": "title"
        },
        {
          "slotId": "body",
          "sourceItemIds": [
            "understand",
            "decide",
            "execute"
          ],
          "contentMode": "full"
        }
      ],
      "reason": "Lead states the overall mechanism title; body lists all three steps and their explanations in order."
    },
    {
      "pageId": "p4",
      "intentId": "p4",
      "compositionId": "editorial-focus",
      "componentItemIds": [],
      "componentContentMode": "none",
      "textSlots": [
        {
          "slotId": "primary",
          "sourceItemIds": [
            "80-value"
          ],
          "contentMode": "full"
        },
        {
          "slotId": "support",
          "sourceItemIds": [
            "not-95"
          ],
          "contentMode": "full"
        }
      ],
      "reason": "Primary holds the 'stable 80' value as the conclusion; support presents the 'random 95' contrast."
    },
    {
      "pageId": "p5",
      "intentId": "p5",
      "compositionId": "editorial-focus-reverse",
      "componentItemIds": [],
      "componentContentMode": "none",
      "textSlots": [
        {
          "slotId": "support",
          "sourceItemIds": [
            "target"
          ],
          "contentMode": "full"
        },
        {
          "slotId": "primary",
          "sourceItemIds": [
            "product-value"
          ],
          "contentMode": "full"
        }
      ],
      "reason": "Reverse layout: target audience as support, product value as the emphasized thesis on the right."
    },
    {
      "pageId": "p6",
      "intentId": "p6",
      "compositionId": "editorial-list",
      "componentItemIds": [],
      "componentContentMode": "none",
      "textSlots": [
        {
          "slotId": "lead",
          "sourceItemIds": [
            "experience"
          ],
          "contentMode": "title"
        },
        {
          "slotId": "body",
          "sourceItemIds": [
            "experience",
            "expand"
          ],
          "contentMode": "full"
        }
      ],
      "reason": "Lead states the core 'experience not template'; body lists the two aspects: accumulation and extensibility."
    },
    {
      "pageId": "p7",
      "intentId": "p7",
      "compositionId": "editorial-list",
      "componentItemIds": [],
      "componentContentMode": "none",
      "textSlots": [
        {
          "slotId": "lead",
          "sourceItemIds": [
            "goal"
          ],
          "contentMode": "title"
        },
        {
          "slotId": "body",
          "sourceItemIds": [
            "goal",
            "result"
          ],
          "contentMode": "full"
        }
      ],
      "reason": "Lead states the common problem; body covers both the goal and the final result."
    }
  ]
}
